Document Order,Normalized Frequency,Raw DF,Abstract
4831,0.017,17.0,"To better understand whether potent antiretroviral therapies can modify the natural history of HIV-1-associated microsporidiosis and cryptosporidiosis, the response to antimicrobial treatment of these opportunistic infections was evaluated in patients with or without antiretroviral treatment. Fifty patients with diarrhoea, all positive for Cryptosporidium parvum or Enterocytozoon bieneusi, were included in the study. Retrospective data were collected concerning demographics, clinical and microbiological characteristics of the parasitic infection, antiretroviral therapy and prophylaxis against opportunistic infections. Faecal samples were prepared using the Richie formalin-ethyl acetate method and stained using the modified Ziehl-Neelsen method for detection of Cryptosporidium parvum and Isospora belli, the modified trichrome and calcofluor white technique for detection of Enterocytozoon spp., and iodine for detection of ova, cysts or vegetative forms. Diarrhoea was defined as an abnormal increase in stool liquidity, an abnormal increase in stool frequency and a daily stool weight of more than 250 g for a period of at least 4 days. Patients treated with double antiretroviral therapy or protease inhibitors demonstrated an excellent response and a sustained therapeutic effect after follow-up (range, 5-36 months). The relapse of cryptosporidiosis in two patients who discontinued antiretroviral therapy suggests that the infection might remain in a latent stage. The resolution of the diarrhoea seems to be related to an increased CD4+ cell count rather than to the viral load. In conclusion, these data strongly support the hypothesis that combination antiretroviral therapy is able to greatly modify the course of cryptosporidiosis and microsporidiosis in patients infected with HIV-1."
8267,0.016,16.0,"It is the position of the American Dietetic Association that efforts to optimize nutritional status through individualized medical nutrition therapy, assurance of food and nutrition security, and nutrition education are essential to the total system of health care available to people with human immunodeficiency virus (HIV) infection throughout the continuum of care. Broad-based efforts to improve health care access and treatment have stabilized HIV prevalence levels in many parts of the world and led to longer survival for people living with HIV infection. Confounding clinical and social issues, such as medication interactions, comorbidities, wasting, lipodystrophy, food insecurity, aging, and other related conditions further complicate disease management. With greater understanding of the mechanisms of HIV disease and its impact on body function, development of new treatments, and wider ranges of populations affected, the management of chronic HIV infection continues to become more complex and demanding. Achievement of food and nutrition security and management of nutrition-related complications of HIV infection remain significant challenges for clients with HIV infection and health care professionals. Registered dietitians and dietetic technicians, registered, should integrate their efforts into the overall health care strategies to optimize their clinical and social influence for people living with HIV infection."
4048,0.015,15.0,"The government of Zimbabwe began providing antiretroviral therapy (ART) to People Living with HIV/AIDS (PLHIV) in public institutions in 2004. In Midlands province two clinics constituted the most active HIV care service points, with patients being followed up through a comprehensive patient monitoring and tracking system which captured specific patient variables and outcomes over time. The data from 2006 to 2011 were subjected to analysis to answer specific research questions and this case study is based on that analysis. The goal of this case study is to build participants' capacity to undertake secondary data analysis and interpretation using a dataset for HIV antiretroviral therapy in Zimbabwe and to draw conclusions which inform recommendations. Case studies in applied epidemiology allow students to practice applying epidemiologic skills in the classroom to address real-world public health problems. Case studies as a vital component of an applied epidemiology curriculum are instrumental in reinforcing principles and skills covered in lectures or in background reading. The target audience includes Field Epidemiology and Laboratory Training Programs (FELTPs), university students, district health executives, and health information officers."
6626,0.015,15.0,"Single-nucleotide polymorphisms (SNP) of two-gene locus cytotoxic T lymphocyte antigen-4 (CTLA-4) +49 and CD86 +1057 were previously reported to influence the outcome of liver transplantation (LT) with respect to allograft acceptance. SNP at CTLA-4 +49 was also suggested to be associated with the individual difference in the clearance of hepatitis B virus (HBV). However, their influence on the incidence of post-LT HBV reinfection was not clear. With the increasing knowledge of costimulatory mechanisms on LT and host immune response, we designed this study to investigate the relationship between different alleles as well as genotypes at these two locations and HBV reinfection after LT."
1691,0.014,14.0,"Human immune deficiency virus (HIV) and tuberculosis (TB) infections remain major public health issues globally, particularly in sub-Saharan Africa. Impairment of both cell-mediated and humoral immunity by HIV and/or TB infections may limit the host's defences against other pathogens, including the diarrheagenic protozoan Cryptosporidium spp., Giardia intestinalis, and Entamoeba histolytica. During September-December 2015 a cross-sectional study was conducted to assess the prevalence and molecular diversity of these enteric parasites among HIV- and/or TB-infected patients at a medical reference centre in Chowke district, southern Mozambique. A total of 99 stool specimens were initially screened by direct microscopy and further confirmed and characterised by molecular methods. DNA sequence analyses of the genes encoding the small subunit ribosomal RNA and the 60-kDa glycoprotein were used for the typing and sub-typing of Cryptosporidium isolates, respectively. G. intestinalis-positive isolates by real-time PCR were subsequently typed at the glutamate dehydrogenase locus. Differential diagnosis of E. histolytica/dispar was achieved by real-time PCR. G. intestinalis (8.1%) was the enteric protozoan more frequently detected, followed by Cryptosporidium spp. (7.1%), and Entamoeba histolytica/dispar (6.1%). Two HIV-infected (but not TB-infected) patients harbour G. intestinalis and Cryptosporidium spp. co-infections. Two (29%) G. intestinalis isolates were successfully characterised, revealing the presence of known AII and novel BIV genotypes. Four (57%) Cryptosporidium isolates were unmistakeable assigned to C. hominis, identifying two (IbA10G2 and IdA22) sub-types. Cryptosporidium infections were not associated to diarrhoea in HIV-positive patients, probably because improved immune function in the affected individuals due to antiretroviral therapy. G. intestinalis was considered a non-opportunistic pathogen, whereas the presence of E. histolytica could not be confirmed by molecular methods. Based on their common presence in the studied clinical population, we recommend the effective diagnosis and treatment of these enteropathogens for improving the management of HIV and TB patients."
5669,0.012,12.0,"The demand for dental treatment by human immunodeficiency virus (HIV)-infected individuals is rising. Some professionals are still reluctant to treat these patients, despite the extremely low likelihood of professional transmission, which increases only in patients with a very elevated viral load. The complications rate after dental intervention is very low, even in patients with considerable immunologic deterioration. The dentist should pay special attention to the general clinical situation and immunologic and HIV virologic status of the seropositive patient, and to the presence of hemostasis alterations or of other concomitant diseases. Antiretroviral or any other drug treatments must also be recorded, in order to avoid possible interactions with clinician-prescribed drugs. Tooth extraction is the most common dental treatment and requires no antibiotic therapy except in cases of neutropenia or severe immunosuppression. Other dental treatments do not require special precautions, and the complications index among these patients is similar to that among the uninfected patient population. With this background, there is a need to make the clinician-in-training aware of the importance of regular dental health checkups as part of the health care routine of HIV-infected patients and to familiarize the clinician with their management, while not disregarding the unquestionable requirement to carry out the general and specific prevention measures to be adopted in all cases."
6369,0.012,12.0,"As of October 2006, 6 medications are approved in the United States for the management of chronic hepatitis B virus (HBV) infection: 2 formulations of interferon and 4 oral nucleos(t)ide analogues. For the treating practitioner, tailoring the pharmaceutical regimen according to patient features and clinical circumstances can be a challenge. First-line therapeutic regimens for the management of HBV infection include monotherapy with a U.S. Food and Drug Administration-approved agent that has potent on-treatment viral response and low rates of resistance; in the future, these regimens may include a combination of more than one nucleos(t)ide analogue or a combination of a nucleos(t)ide analogue and pegylated interferon. The oral nucleos(t)ide analogues are generally better tolerated than interferon; however, they can be expensive when administered for lengthy periods and can also lead to medication resistance. Lamivudine, the first approved nucleoside analogue for the treatment of HBV infection, has a very high resistance profile; in fact, lamivudine exposure increases viral resistance to other commercially available nucleos(t)ide analogues: entecavir, telbivudine, and adefovir. For these reasons, the 2007 American Association for the Study of Liver Diseases (AASLD) guidelines no longer recommend lamivudine as first-line therapy for the management of HBV infection. A satellite symposium conducted during the 57th Annual Meeting of the AASLD in Boston, Massachusetts, presented approaches to customizing the management of chronic HBV infection. The presentation highlighted recent findings suggesting that early, profound, and sustained viral suppression improves the probability of sustained virologic response and reduces the likelihood of nucleos(t)ide resistance."
6040,0.012,12.0,"Health care personnel are at high risk for hepatitis B virus (HBV) transmission. The aim of the present study was to investigate hepatitis B (HB) knowledge and vaccination acceptance among health care personnel in southwestern Greece, using the Hepatitis B Vaccine Knowledge and Acceptance Questionnaire. One hundred eighty-three employees participated (71 males). Occupation (p < .001), higher education (p < .001), and vaccination (p = .007) were significantly related to HB knowledge. The rate of HBV vaccination coverage was 70.9%. Participants considering themselves at high risk for HBV infection did not report significantly increased vaccination rates. In the multivariate analysis, university personnel (p = .002), occupational category (p < .001), and HB knowledge (p = .049) were significantly associated with vaccination. In conclusion, 29% of hospital personnel were not vaccinated mainly due to negligence. Occupation, education, and knowledge about HB seem to be associated with HBV vaccination."
1718,0.012,12.0,"Nonadherence to combination antiretroviral (ARV) therapies (cART) is highly prevalent and significantly increases the risk of adverse human immunodeficiency virus (HIV) disease outcomes. The current study evaluated the hypothesis that prospective memory-a dissociable aspect of episodic memory describing the ability to execute a future intention-plays an important role in successful cART adherence. Seventy-nine individuals with HIV infection who were prescribed at least one ARV medication underwent a comprehensive neuropsychological and neuromedical evaluation prior to completing a 1-month observation of their cART adherence as measured by electronic medication monitoring. Nonadherent individuals (n = 31) demonstrated significantly poorer prospective memory functioning as compared to adherent persons (n = 48), particularly on an index of time-based ProM (i.e., elevated loss of time errors). Deficits in time-based prospective memory were independently predictive of cART nonadherence, even after considering the possible influence of established predictors of adherence, such as general cognitive impairment (e.g., retrospective learning and memory) and psychiatric comorbidity (e.g., depression). These findings extend a nascent literature showing that impairment in time-based prospective memory significantly increases the risk of medication nonadherence and therefore may guide the development of novel strategies for intervention. (JINS, 2009, 15, 42-52.)."
8635,0.012,12.0,"Coinfection with HIV and hepatitis B virus (HBV) is common in resource-limited settings but is frequently not diagnosed. The authors retrospectively tested specimens for HBV in HIV-infected Thai women who had participated in an antiretroviral therapy (ART) clinical study. A substantial proportion (27 of 211; 13%) of HIV-infected women were HBV coinfected. Among HIV/HBV-coinfected women, the authors observed similar rates of antiretroviral-associated liver toxicity (despite nevirapine [NVP] use) and CD4 count reconstitution as observed in HIV-monoinfected women. Hepatitis B surface antigen (HBsAg) screening detected the majority (81%) of HBV coinfections, including all 5 HBV-coinfected women who did not suppress HBV despite 48 weeks of lamivudine (3TC)-containing ART and could be used to tailor ART for patients diagnosed with HBV coinfection in accordance with World Health Organization guidelines. Although HBsAg screening did not diagnose 5 occult HBV coinfections, these women achieved HBV suppression on 3TC-containing ART, suggesting that not detecting occult HBV coinfection would have limited clinical impact. "
8908,0.011,11.0,"Following human immunodeficiency virus type 1 (HIV-1) integration into host cell DNA, the viral promoter can become transcriptionally silent in the absence of appropriate signals and factors. HIV-1 gene expression is dependent on regulatory elements contained within the long terminal repeat (LTR) that drive the synthesis of viral RNAs and proteins through interaction with multiple host and viral factors. Previous studies identified single nucleotide polymorphisms (SNPs) within CCAAT/enhancer binding protein (C/EBP) site I and Sp site III (3T, C-to-T change at position 3, and 5T, C-to-T change at position 5 of the binding site, respectively, when compared to the consensus B sequence) that are low affinity binding sites and correlate with more advanced stages of HIV-1 disease. Stably transfected cell lines containing the wild type, 3T, 5T, and 3T5T LTRs were developed utilizing bone marrow progenitor, T, and monocytic cell lines to explore the LTR phenotypes associated with these genotypic changes from an integrated chromatin-based microenvironment. Results suggest that in nonexpressing cell clones LTR-driven gene expression occurs in a SNP-specific manner in response to LTR activation or treatment with trichostatin A treatment, indicating a possible cell type and SNP-specific mechanism behind the epigenetic control of LTR activation. "
1165,0.01,10.0,"Physical function limitations have been associated with poor health outcomes, which have a negative impact on quality of life of older individuals. This study examined the association between depression, viral load, and acculturation with physical function among Latino men living with HIV. A secondary data analysis was performed using a cross-sectional data of 146 Latino immigrant men living with HIV in New York City and Washington, DC. Physical function was measured using the Short-Form Health Survey (SF-12). Uncontrolled HIV infection and depression were associated with worse physical function, thus implying the importance of adequate health care to address these conditions. Preserving physical function should start during middle adulthood, particularly among people living with HIV because of their greater risk of developing age-related challenges such as depression, diabetes, cardiovascular diseases among others. This study informs future interventions to preserve physical function and achieve the goal of successful aging."
3236,0.01,10.0,"The value of CD4 lymphocyte counts as a surrogate marker in persons with advanced human immunodeficiency virus infection during antiretroviral treatment was assessed using longitudinal models and data from the Terry Beirn Community Programs for Clinical Research on AIDS didanosine/zalcitabine trial of 467 HIV-infected patients. Patients with AIDS or two CD4 counts of < or = 300 who fulfilled specific criteria for zidovudine intolerance or failure were randomized to receive either 500 mg didanosine (ddl) daily or 2.25 mg zalcitabine (ddC) per day. Absolute CD4 counts were recorded at study entry and at as many as four visits. Patients were followed for clinical disease progression and survival. At 2 months, the difference in mean CD4 count from baseline was +15.4 cells/mm3 in the ddI group but -1.3 cells/mm3 in the ddC group. Patients assigned to ddI had a greater chance of a CD4 response at 2 months than those on ddC, yet only those in the ddC group with a response showed significant improvement in progression of disease or survival compared with ddC nonresponders, ddI responders, and ddI nonresponders (p = 0.03). We conclude that a CD4 response does not necessarily correlate with improved outcome and is therefore not a useful surrogate marker in these patients."
4563,0.01,10.0,"Human immunodeficiency virus (HIV) infection alters the epidemiology of mycobacterial infections. In the industrialised world, this has led to an increase in severe illness associated with Mycobacterium avium-intracellulare complex (MAC) and, in the developing world, to doubling of tuberculosis cases in some countries in Sub-Saharan Africa. The interaction with Mycobacterium tuberculosis occurs when the CD4 count is relatively high (> 200) and tuberculosis (TB) is now the commonest presenting AIDS defining disease in Africa. In international public health terms the interaction between TB and HIV infection has led to the World Health Organisation declaring TB to be a global emergency. Both TB and HIV are diseases of poverty and the key to the reduction of incidence of both diseases is the improvement of socio-economic conditions. Other control methods are case finding and treatment, chemoprophylaxis and BCG vaccination. Finding active (sputum positive) case of tuberculosis and treating them is the function of TB control programmes in all countries, but poor adherence to medication has lead to low cure rates and increasing development of drug resistance. Resources are needed to improve adherence to medication and for research to improve diagnostic methods and treatment."
6042,0.01,10.0,"Increased concentrations of neopterin, a marker for cell-mediated immune activation, and decreased numbers of CD4+ T cells, are predictors for progression of disease after infection with human immunodeficiency virus type 1. Previous studies have demonstrated different rates of onset of full-blown acquired immunodeficiency syndrome (AIDS) for groups of patients, defined by laboratory marker values, who were initially symptom-free. By re-analysis of one such study, we demonstrate how for an individual patient, the individual marker values, together with a prior risk estimate, can be converted into current or accumulated post-test probability of onset of AIDS at a certain time. We used a statistical technique suggested by Albert et al. (Clin Chem 1984;30:69-76), which allows incorporation of fixed and time-dependent covariates. Besides allowing individual projections, the method shows that the predictive abilities of CD4+ T cell numbers and of neopterin concentrations do not vary greatly with regard to time of observation; both laboratory markers independently modulate the underlying prior probability of AIDS onset, which is significantly increased with the passage of time."
1795,0.01,10.0,"Wasting and food insecurity are commonly seen in patients receiving antiretroviral treatment (ART) programs in sub-Saharan Africa and south Asia, and supplementary feeding is often offered in conjunction with ART. Evidence for the effectiveness of such supplementary feeding is scant. A randomised, investigator-blinded, controlled clinical trial of two types of supplementary food, corn/soy blended flour and a ready-to-use peanut butter-based lipid paste, in wasted adults in Blantyre, Malawi is described and the results summarised. A historical control group who did not receive supplementary food is described as well. Provision of about half of the daily energy requirement as a supplementary food for 14 weeks resulted in more rapid restoration of a normal BMI; and the energy-dense, ready-to-use paste was associated with more rapid weight gain than the blended flour. Survival was similar among the 3 groups. The strong association between lower BMI and survival indirectly suggests that there may well be clinical benefit from supplementary feeding in this population. No differences were seen in ART adherence or quality of life with more rapid restoration of BMI. Further research is urgently needed concerning the widespread practice of supplementary feeding in HIV/AIDS care to most effectively utilize this intervention."
3596,0.01,10.0,"Multi-nucleos(t)ide resistance (MNR) mutations including Q151M, K65R mutations, and insertion at codon 69 of HIV-1 reverse transcriptase coding region may confer resistance to all molecules of nucleos(t)ide reverse transcriptase inhibitors (NRTI). The presence of these mutations is an emerging problem compromising non-nucleoside reverse transcriptase inhibitors and protease inhibitors-based therapies. Furthermore, factors associated with selection of these mutations are still not well defined. The current study aimed to evaluate the frequency and to characterize factors associated with the occurrence of multi-nucleos(t)ide resistance mutations among HIV-1 infected patients failing recommended first-line antiretroviral regimens in Cambodia."
8847,0.01,10.0,Recent studies have suggested that host genetics may be useful for predicting drug response and have supported the recommendation that single polynucleotide polymorphisms (SNPs) of IL28B should be investigated when treating hepatitis C virus (HCV)-1 infected patients. The aim of this study was to determine whether a single IL-28B genotype SNP rs8099917 or rs12979860 determination is sufficient to predict treatment failure in patients with chronic HCV.
4248,0.009,9.0,"Hepatitis delta virus (HDV) usually have an unfavorable clinical outcome in chronic hepatitis B virus (HBV) patients. In Egypt, data about epidemiology, the spectrum of disease, and impact of HDV on HBV infection are rare. To assess the prevalence, clinical and virological characteristics of HDV infection among Egyptian patients with chronic HBV. Adult patients with Hepatitis B surface antigen (HBsAg)-positive were evaluated for the presence of HDV using anti HDV-IgG and HDV RNA by RT-PCR. Routine laboratory investigations, genotypes and subtypes for both HBV and HDV, abdominal sonography, and transient elastography (TE) were done. Liver biopsy was performed only in whenever indicated. One hundred and twenty-one treatment-naïve chronic HBV patients were included. Wild HBV genotype-D2 was found in 98.2% and 81.9% were HBeAg negative. Prevalence of HDV was 8.3% by anti-HDV IgG and 9.9% by RT-PCR. Wild HDV genotype-IIb was reported in 83.3%. HDV infection was more common in males, 90.9% of delta patients were HBeAg negative. Compared to the mono-infected HBV, concomitant HBV/HDV infection was not associated with more derangment in ALT nor advanced stage of fibrosis. 66.7% of HDV patients had significantly lower HBV-DNA level compared to the non-delta patients (P < 0.001). HDV is not uncommon in Egypt. HBV genotype-D was associated with HDV genotype-IIb. Delta infection was associated with negative HBeAg status, reduction of HBV replication, but neither influenced the clinical course nor increased significant liver damage risk."
5000,0.009,9.0,"Current data indicate that the risk for transmitting bloodborne pathogens in dental health care settings is low. Pre-exposure hepatitis B vaccination and the use of standard precautions to prevent exposure to blood are the most effective strategies for preventing DHCP from occupational infection with HIV, HBV or HCV. Each dental health care facility should develop a comprehensive written program for preventing and managing occupational exposures to blood that: (1) describes the types of blood exposures that may place DHCP at risk for infection; (2) outlines procedures for promptly reporting and evaluating such exposures; and (3) identifies a health care professional who is qualified to provide counseling and perform all medical evaluations and procedures in accordance with the most current USPHS recommendations. Finally, resources should be available that permit rapid access to clinical care, testing, counseling, and PEP for exposed DHCP and the testing and counseling of source patients."
