Document Order,Normalized Frequency,Raw DF,Abstract
9598,0.005,5.0,"Occult hepatitis B virus (HBV) infection is characterized by the presence of HBV DNA in the absence of hepatitis B surface antigen (HBsAg) in the patient serum. Although such infections have been identified in patients with chronic hepatitis C, the clinical significance of those co-infections is still not understood. Our aim was, therefore, to assess the prevalence and clinical consequences of occult HBV infection in chronic hepatitis C patients undergoing antiviral therapy."
476,0.005,5.0,"Cytotoxic T-lymphocyte (CTL) responses peak coincident with the decline in acute HIV viremia. Despite two reports of CTL-resistant HIV variants emerging during acute infection, the contribution of acute CTL escape to HIV pathogenesis remains unclear. Difficulties inherent in studying acute HIV infection can be overcome by modeling virus-host interactions in SIV-infected rhesus macaques. We sequenced 21 complete simian immunodeficiency virus (SIV)mac239 genomes at four weeks post-infection to determine the extent of acute CTL escape. Here we show that viruses from 19 of 21 macaques escaped from CTLs during acute infection and that these escape-selecting CTLs were responsive to lower concentrations of peptide than other SIV-specific CTLs. Interestingly, CTLs that require low peptide concentrations for stimulation (high 'functional avidity') are particularly effective at controlling other viral infections. Our results suggest that acute viral escape from CTLs is a hallmark of SIV infection and that CTLs with high functional avidity can rapidly select for escape variants."
7837,0.005,5.0,"The effect of macrophage (M)-tropic and T cell line (T)-tropic human immunodeficiency virus type 1 (HIV-1) infection on antigen-specific CD4 cytotoxic T lymphocytes (CTLs) has been studied using a CD4 CTL line specific for a peptide from influenza B virus hemagglutinin. In the absence of antigen presentation, the production of CC chemokines was low. Both the M-tropic HIV-1 strain (HIV-1AD) and the T-tropic HIV-1 strain (HIV-1LAI) established productive infections in the CD4 CTLs, decreasing antigen-specific cytotoxicity. Peptide presented to the CD4 CTLs increased their secretion of RANTES and MIP-1beta, suppressed M-tropic HIV-1 replication, downmodulated CCR5 expression, and preserved CTL recognition. The suppression of M-tropic HIV-1 replication and downmodulation of the CCR5 receptor likely resulted from CC chemokine secretion since antibodies to CC chemokines restored M-tropic HIV-1 replication. Antigen presentation did not protect CD4 CTLs from T-tropic HIV-1 infection or preserve their CTL recognition. Thus, these CD4 CTLs do not make suppressor factors that inhibit the T-tropic HIV-1LAI isolate. The results indicate that these CD4 CTLs can either harbor or suppress M-tropic HIV-1 infection, depending on whether antigen is present. CD4 CTLs might therefore provide some protection in the early stages of HIV-1 infection when M-tropic isolates are present."
4844,0.005,5.0,"A major barrier to the elimination of HIV-1 infection is the presence of a pool of long-lived, latently infected CD4+ memory T-cells. The search for treatments to re-activate latent HIV to aid in clearance is hindered by the incomplete understanding of the mechanisms that lead to transcriptional silencing of viral gene expression in host cells. Here we identify a previously unknown role for RUNX1 in HIV-1 transcriptional latency. The RUNX proteins, in combination with the co-factor CBF-β, are critical transcriptional regulators in T-cells. RUNX1 strongly modulates CD4 expression and contributes to CD4+ T-cell function. We show that RUNX1 can bind DNA sequences within the HIV-1 LTR and that this binding represses transcription. Using patient samples we show a negative correlation between RUNX1 expression and viral load. Furthermore, we find that pharmacologic inhibition of RUNX1 by a small molecule inhibitor, Ro5-3335, synergizes with the histone deacetylase (HDAC) inhibitor SAHA (Vorinostat) to enhance the activation of latent HIV-1 in both cell lines and PBMCs from patients. Our findings indicate that RUNX1 and CBF-β cooperate in cells to modulate HIV-1 replication, identifying for the first time RUNX1 as a cellular factor involved in HIV-1 latency. This work highlights the therapeutic potential of inhibitors of RUNX1 to re-activate virus and aid in clearance of HIV-1. "
2026,0.005,5.0,"We estimate how the effect of antiretroviral treatment depends on the time from HIV-infection to initiation of treatment, using observational data. A major challenge in making inferences from such observational data arises from biases associated with the nonrandom assignment of treatment, for example bias induced by dependence of time of initiation on disease status. To address this concern, we develop a new class of Structural Nested Mean Models (SNMMs) to estimate the impact of time of initiation of treatment after infection on an outcome measured a fixed duration after initiation, compared to the effect of not initiating treatment. This leads to a SNMM that models the effect of multiple dosages of treatment on a time-dependent outcome, in contrast to most existing SNNMs, which focus on the effect of one dosage of treatment on an outcome measured at the end of the study. Our identifying assumption is that there are no unmeasured confounders. We illustrate our methods using the observational Acute Infection and Early Disease Research Program (AIEDRP) Core01 database on HIV. The current standard of care in HIV-infected patients is Highly Active Anti-Retroviral Treatment (HAART); however, the optimal time to start HAART has not yet been identified. The new class of SNNMs allows estimation of the dependence of the effect of 1 year of HAART on the time between estimated date of infection and treatment initiation, and on patient characteristics. Results of fitting this model imply that early use of HAART substantially improves immune reconstitution in the early and acute phase of HIV-infection."
2578,0.005,5.0,"The emergence of multidrug-resistant (MDR) and extensively drug-resistant (XDR) Mycobacterium tuberculosis prompted the reintroduction of para-aminosalicylic acid (PAS) to protect companion anti-tuberculosis drugs from additional acquired resistance. In sub-Saharan Africa, MDR/XDR tuberculosis with HIV coinfection is common, and concurrent treatment of HIV infection and MDR/XDR tuberculosis is required. Out of necessity, patients receive multiple drugs, and PAS therapy is frequent; however, neither potential drug interactions nor the effects of HIV infection are known. Potential drug-drug interaction with PAS and the effect of HIV infection was examined in 73 pulmonary tuberculosis patients; 22 (30.1%) were HIV coinfected. Forty-one pulmonary MDR or XDR tuberculosis patients received 4 g PAS twice daily, and in a second crossover study, another 32 patients were randomized, receiving 4 g PAS twice daily or 8 g PAS once daily. A PAS population pharmacokinetic model in two dosing regimens was developed; potential covariates affecting its pharmacokinetics were examined, and Monte Carlo simulations were conducted evaluating the pharmacokinetic-pharmacodynamic index. The probability of target attainment (PTA) to maintain PAS levels above MIC during the dosing interval was estimated by simulation of once-, twice-, and thrice-daily dosing regimens not exceeding 12 g daily. Concurrent efavirenz (EFV) medication resulted in a 52% increase in PAS clearance and a corresponding >30% reduction in mean PAS area under the concentration curve in 19 of 22 HIV-M. tuberculosis-coinfected patients. Current practice recommends maintenance of PAS concentrations at ≥1 μg/ml (the MIC of M. tuberculosis), but the model predicts that at only a minimum dose of 4 g twice daily can this PTA be achieved in at least 90% of the population, whether or not EFV is concomitantly administered. Once-daily dosing of 12 g PAS will not provide PAS concentrations exceeding the MIC over the entire dosing interval if coadministered with EFV, while 4 g twice daily ensures concentrations exceeding MIC over the entire dosing interval, even in HIV-infected patients who received EFV. "
166,0.005,5.0,"To determine whether human immunodeficiency virus type 1 (HIV-1) strains in the lungs of infected individuals are derived from proviral forms contemporaneously present in the peripheral blood or whether they evolve independently as an autonomous pool of viral quasispecies, HIV-1 envelope V3 domain structures at these sites were analyzed and compared. The V3 loop proviral nucleotide and inferred amino acid sequences from lung bronchoalveolar lavage, where HIV-1 is primarily found in macrophages, were more homogeneous within individuals than those from unseparated peripheral blood mononuclear cells, where virus is predominantly in T cells. Comparison between individuals revealed that strains from bronchoalveolar lavage, but not from peripheral blood mononuclear cells, contained V3 domain nucleotide sequences with a great degree of homogeneity in the C-terminal region and a highly conserved, negatively charged amino acid motif. This V3 loop C-terminal structure could be important in the ability of HIV-1 to infect alveolar macrophages. Phylogenetic analyses of V3 domain nucleotide sequences in cells of monocyte/macrophage lineage at both sites revealed the strains in lung macrophages to have evolved further from a presumed ancestral species than those in blood monocytes and to differ considerably in the inferred V3 loop amino acid structures. These results show that, as disease progression occurs, viral strains in monocyte/macrophage lineage cells within the lung and blood microenvironments are not in a state of unrestricted bidirectional traffic but, instead, evolve independently."
2498,0.005,5.0,"The spread of hepatitis B virus (HBV) infection has gradually decreased in Italy in the last 5 decades as shown by the steady reduction in the incidence rates of acute hepatitis B, from 10/100000 inhabitants in 1984 to 0.85/100000 in 2012, and by the reduced prevalence of hepatitis B surface antigen (HBsAg)-positive cases among chronic hepatitis patients with different etiologies, from 60% in 1975 to about 10% in 2001. The prevalence of HBsAg chronic carriers in the general population also decreased from nearly 3% in the 1980s to 1% in 2010. Linked to HBV by its characteristics of defective virus, the hepatitis delta virus (HDV) has shown a similar epidemiological impact on the Italian population over time. The incidence of acute HDV infection decreased from 3.2/100000 inhabitants in 1987 to 0.8/100000 in 2010 and the prevalence of HDV infection in HBsAg chronic carriers decreased from 24% in 1990 to 8.5% in 2006. Before the beneficial effects of HBV mass vaccination introduced in 1991, the decreased endemicity of HBV and HDV infection in Italy paralleled the improvement in screening blood donations, the higher standard of living and impressive reduction in the birth rate associated with a marked reduction in the family size. A further contribution to the decline in HBV and HDV infections most probably came from the media campaigns to prevent the spread of human immunodeficiency virus infection by focusing the attention of the general population on the same routes of transmission of viral infections such as unsafe sexual intercourse and parenteral exposures of different kinds. "
2954,0.005,5.0,"The aim of this study was to evaluate whether patients with chronic hepatitis delta virus (HDV) infection treated with alpha interferon and subsequent loss of hepatitis B surface antigen (HBsAg) eliminate HDV. HDV RNA was detected in 26 of 28 patients with chronic delta hepatitis using the polymerase chain reaction. Seventeen patients in whom HDV RNA was detected were treated with alpha interferon; in 65%, HDV RNA remained detectable during treatment or reappeared after stopping therapy whereas in three patients HDV RNA remained absent (17.5%). HDV RNA became and remained undetectable in serum and liver of two of these three patients who lost HBsAg from serum and in one patient who was intermittently HBsAg negative during therapy. After loss of HBsAg, hepatitis B virus (HBV) DNA was still detectable in the liver, but not HBV RNA, indicating absent or very low HBV replication. Three patients were lost to follow up (17.5%). Two nontreated patients with chronic HDV infection also lost HBsAg during follow up; HDV RNA also became undetectable in their serum. Thus, HDV replication does not persist after the loss of HBsAg. Clearance of HBsAg may be a useful guide to when therapy can be stopped."
6449,0.005,5.0,"Epidemiological data on hepatitis delta virus (HDV) infection in Belgium are lacking. A multicenter questionnaire-based registry on HDV infection was collated between March 1, 2008 and February 28, 2009. It consisted of patients coinfected with hepatitis B virus (HBV) and HDV. The data samples were compared to those of a concurrent registry on HBV infection. Prospective data of patients with HBV-HDV coinfection were collected. Active HBV replication is defined as HBeAg positivity or HBV DNA > 2,000 IU/ml. Forty-four patients from 15 centers were registered. A comparison of 29 patients infected with HDV (registered in the concurrent HBV registry) was made against 785 HBV mono-infected patients. The seroprevalence of patients coinfected with HBV and HDV in Belgium is reported to be 3.7% (29/785), consisting solely of the HBV-HDV coinfected patients in the HBV registry. This rises to 5.5% (44/800) if all patients infected with HDV from the two registries combined are included. The patients coinfected with HBV and HDV had higher (P < 0.05) ALT values and more advanced liver disease (Metavir score ≥F2), but had less active HBV replication and lower HBV DNA titers when compared with the patients infected only with HBV. Additionally, the majority of HBV-HDV coinfected patient was male, and 13.6% (6/44) of the patients that were coinfected HBV and HDV were also infected with HCV. In conclusion, this study provided much needed epidemiological data on the current state of HDV infection in Belgium."
9758,0.005,5.0,"Smoking rates among people living with human immunodeficiency virus/acquired immunodeficiency syndrome (HIV/AIDS; PLWHA) are at least twice as high as rates in the general population. Consistent with the reciprocal model of pain and smoking, PLWHA with pain who smoke may use smoking as a means of coping with pain, thus presenting a potential barrier to quitting. The aim of this study is to better understand how pain relates to smoking cessation among 474 HIV-positive adults enrolled in a cell phone-delivered smoking cessation trial."
4038,0.005,5.0,"Pegylated-IFN and ribavirin remains the current treatment for chronic HCV infection in patients co-infected with HIV-1, but this regimen has low efficacy rates, particularly for HCV genotype 1/4 infection, has severe side effects and is extremely costly. Therefore, accurate prediction of treatment response is urgently required. We have recently shown that the NK cell gene, KIR2DS3 and a SNP associated with the IL28B gene synergise to increase the risk of chronic infection in primary HCV mono-infected patients. Identification of SNPs associated with the IL28B gene has also proven very powerful for predicting patient response to treatment. Patients co-infected with HIV-1 are of particular concern given they respond less well to HCV treatment, have more side effects and suffer a more rapid liver disease progression. In this study, we examined both IL28B and KIR2DS3 for their ability to predict treatment response in a cohort of HIV-1/HCV co-infected patients attending two treatment centres in Europe. We found that variation in both host genetic risk factors, IL28B and KIR2DS3, was strongly associated with sustained virological response (SVR) to treatment in our co-infected cohort (n = 149). The majority of patients who achieved a rapid virological response (RVR) achieved a SVR. However, it is currently impossible to predict treatment outcome in patients who fail to achieve an RVR. In our cohort, the presence of host genetic risk factors, IL28B-T and KIR2DS3 alleles, resulted in increased odds of treatment failure in these RVR negative patients (n = 88). Our data suggests that testing for host genetic factors will improve predicting treatment responsiveness in the clinical management of co-infected patients, and provides further evidence of the importance of the innate immune system in the immune response to HCV. "
2318,0.005,5.0,"Occult hepatitis B virus (HBV) infection (OBI) is defined as the presence of HBV DNA in the liver (with or without detectable HBV DNA in serum) for individuals testing HBV surface antigen negative. Until recently, the clinical effect of OBI was unclear on the progression of liver disease; on the development of hepatocellular carcinoma; and on the risk for reactivation or transmission of HBV infection. Several studies suggest a high prevalence of OBI among patients with cryptogenic chronic liver disease, but its role in the progression to cirrhosis remains unclear. Although OBI has been well documented in human immunodeficiency virus (HIV)-positive patients, especially among those coinfected with hepatitis C virus, further studies are needed to determine its current clinical impact in HIV setting."
6204,0.005,5.0,"Several studies had previously demonstrated the high sensitivity and specificity of JCV DNA detection in CSF by PCR. This paper reported the implementation of a simple PCR procedure to detect JCV in the CSF in a cohort of HIV-1 infected patients from Argentina. Years ago, the confirmatory diagnosis of this disease was made by in-situ hybridization or immunohistochemistry techniques on brain biopsies. The PCR procedure described here improves the diagnosis of PML because it is simple and noninvasive, and allows the differential diagnosis of PML from other neurological syndromes associated with AIDS. Many recent studies report a significant benefit of combined antiretroviral therapy on the survival of HIV patients without clear neurological improvements. A negative correlation has been described between the concentration of JCV in the CSF and survival time in HIV-1 infected patients, and the level of immune depression may influence JCV replication. This suggests that a single CSF JCV viral load determination during the course of PML disease progression may be of prognostic value for managing HIV patients."
2398,0.005,5.0,"In the current study we investigated the prevalence of the TNF-α 238G/A single nucleotide polymorphism (SNP) of the TNF-α gene in the development of lipodystrophy among HIV-1 infected individuals who had been receiving antiretroviral therapy (ART) in the immunodeficiency clinics of the National AIDS Research Institute (NARI) at Pune, India. We assessed the association of this SNP with the development of lipoatrophy/dyslipidemia and insulin resistance in these patients and measured carotid intima thickening which is a surrogate marker for chronic cardiac morbidity. Our results show that the incidence of the TNF-α 238G/A SNP is ~ two fold higher in patients with lipodystrophy as compared to those without lipodystrophy. Patients with lipodystrophy demonstrated a higher likelihood of the development of metabolic syndrome as evident by increased insulin sensitivity and increased percentage (%) β cell function. Further, a significant increase in left carotid intima thickness was observed in patients with lipodystrophy. Our study validates the association of the TNF-α 238G/A SNP allelic variant with the development of HIV- lipodystrophy via the modulation of TNF-α production, which contributes to dyslipidemia, increased lipolysis, increased insulin resistance, altered differentiation of adipocytes and increased carotid intima thickness. The contribution of genetic determinants such as the TNF-α 238G/A SNP to lipodystrophy, may provide insight into the mechanisms that underlie this disease condition and may be useful in the future for personalized therapy. Additionally, these findings will be useful in monitoring chronic cardiac morbidities among HIV infected individuals who express this SNP. "
3662,0.005,5.0,"Highly active antiretroviral therapy (HAART) can suppress HIV-1 replication and normalize the chronic immune activation associated with infection, but restoration of naïve CD4+ T cell populations is slow and usually incomplete for reasons that have yet to be determined. We tested the hypothesis that damage to the lymphoid tissue (LT) fibroblastic reticular cell (FRC) network contributes to naïve T cell loss in HIV-1 infection by restricting access to critical factors required for T cell survival. We show that collagen deposition and progressive loss of the FRC network in LTs prior to treatment restrict both access to and a major source of the survival factor interleukin-7 (IL-7). As a consequence, apoptosis within naïve T cell populations increases significantly, resulting in progressive depletion of both naïve CD4+ and CD8+ T cell populations. We further show that the extent of loss of the FRC network and collagen deposition predict the extent of restoration of the naïve T cell population after 6 month of HAART, and that restoration of FRC networks correlates with the stage of disease at which the therapy is initiated. Because restoration of the FRC network and reconstitution of naïve T cell populations are only optimal when therapy is initiated in the early/acute stage of infection, our findings strongly suggest that HAART should be initiated as soon as possible. Moreover, our findings also point to the potential use of adjunctive anti-fibrotic therapies to avert or moderate the pathological consequences of LT fibrosis, thereby improving immune reconstitution."
8868,0.005,5.0,"The World Health Organization developed a set of human immunodeficiency virus drug resistance (HIVDR) early warning indicators (EWIs) to assess antiretroviral therapy clinic and program factors associated with HIVDR. EWIs are monitored by abstracting data routinely recorded in clinical records, and the results enable clinics and program managers to identify problems that should be addressed to minimize preventable emergence of HIVDR in clinic populations. As of June 2011, 50 countries monitored EWIs, covering 131 686 patients initiating antiretroviral treatment between 2004 and 2009 at 2107 clinics. HIVDR prevention is associated with patient care (appropriate prescribing and patient monitoring), patient behavior (adherence), and clinic/program management efforts to reduce treatment interruptions (follow up, retention on first-line ART, procurement and supply management of antiretroviral drugs). EWIs measure these factors and the results have been used to optimize patient and population treatment outcomes."
2504,0.005,5.0,"Minority variant human immunodeficiency virus type 1 (HIV-1) nonnucleoside reverse transcriptase inhibitor (NNRTI) resistance mutations are associated with an increased risk of virological failure during treatment with NNRTI-containing regimens. To determine whether individuals to whom variants with isolated NNRTI-associated drug resistance were transmitted are at increased risk of virological failure during treatment with a non-NNRTI-containing regimen, we identified minority variant resistance mutations in 33 individuals with isolated NNRTI-associated transmitted drug resistance and 49 matched controls. We found similar proportions of overall and nucleoside reverse transcriptase inhibitor-associated minority variant resistance mutations in both groups, suggesting that isolated NNRTI-associated transmitted drug resistance may not be a risk factor for virological failure during treatment with a non-NNRTI-containing regimen."
