Document Order,Normalized Frequency,Raw DF,Abstract
9717,0.005,5.0,"Combination antiretroviral therapy (cART) can improve immune system function through suppression of HIV-1 replication. However, paradoxical immune response may develop in some patients as a result of effective therapy followed by immune restoration. The phenomena is known as IRS, immune reconstitution syndrome/immune recovery syndrome. IRS can develop within weeks to months after cART is commenced and the time is related to the type of the disease. There are but scant reports concerning IRS-NHL (non-Hodgkin's lymphoma) in HIV-1 positive subjects. We observed 4 (33%) cases of IRS-NHL out of 12 patients in whom NHL was diagnosed. As a result of potent cART they reached viral suppression in a mean time of 15 weeks followed by a rise in CD4(+) T cells within 16.5 weeks. The diagnosis of NHL was established at a mean time of 36 weeks after cART was introduced and 20 weeks after the CD4 T cell increase was achieved. This may indicate that the immune reconstitution as a result of cART was a predisposing factor for the development of NHL in our patients. There was prompt progression of the disease and the outcome was fatal in all cases. IRS-NHL should be suspected in any case of lymphadenopathy, generalized or limited to the abdomen or periphery, which develops after immune recovery due to potent cART within a few months."
1987,0.005,5.0,"Patients with human immunodeficiency virus (HIV) infection often develop multiple complications and comorbidities. Opportunistic infections should always be considered in the evaluation of symptomatic patients with advanced HIV/AIDS, although the overall incidence of these infections has decreased. Primary care of HIV infection includes the early detection of some complications through screening at-risk and symptomatic patients with routine laboratory monitoring (e.g., comprehensive metabolic and lipid panels) and validated tools (e.g., the HIV Dementia Scale). Treatment of many chronic complications is similar for patients with HIV infection and those without infection; however, combination antiretroviral therapy has shown benefit for some conditions, such as HIV-associated nephropathy. For other complications, such as cardiovascular disease and lipoatrophy, management may include switching antiretroviral regimens to reduce exposure to HIV medications known to cause toxicity."
4829,0.005,5.0,"We have analyzed the sequences of HIV-1 reverse transcriptase and protease genes in peripheral blood mononuclear cells obtained from patients receiving antiretroviral therapy to evaluate the drug resistance-associated mutations. Of 84 HIV-1-infected individuals treated with reverse transcriptase inhibitors, 43 (51.2%) have been found to carry amino acid substitutions predicted to acquire drug-resistances. One to 3 mutations at amino acid residues reported to be associated with protease inhibitor-resistance were detected in more than 80% of protease inhibitor-naive patients. However, these pre-existing mutations did not seem to raise a real resistance after the initiation of therapy with protease inhibitors. Phenotypic resistance assay was performed with 6 clinical isolates to compare with genotypic resistance. In most of the cases, phenotype was correlated with genotypic changes, however, two strains which were isolated from patients having no experience of chemotherapy showed a decrease in susceptibility to several drugs without any resistance-related mutations detected in their genes. Taken together, determination of phenotypic resistance is necessary, especially when a newly-infected patients starts antiviral therapy."
7939,0.004,4.0,"In recent years, treatment options for human immunodeficiency virus type 1 (HIV-1) infection have changed from nonboosted protease inhibitors (PIs) to nonnucleoside reverse-transcriptase inhibitors (NNRTIs) and boosted PI-based antiretroviral drug regimens, but the impact on immunological recovery remains uncertain."
7716,0.004,4.0,"HIV-infected patients are at increased risk for persistent human papillomavirus (HPV) infection, the major cause of anogenital cancer. The present study describes the HPV prevalence in urine samples of 243 HIV-infected men and a control group of 231 men. HPV DNA was amplified by the SPF10 polymerase chain reaction primer set. The overall HPV prevalence in HIV-infected men was 27.5% compared with 12.6% in controls (P < 0.01). Infections with high-risk and multiple HPV genotypes were present in both groups. Differences were not statistically significant. A multivariate logistic regression model showed a decreased HPV prevalence associated with use of a nucleoside and a non-nucleoside reverse transcriptase inhibitor combination (P = 0.03). A trend was observed towards a higher HPV prevalence and a lower CD4 cell count. Further prospective studies are needed to determine the role of HPV DNA testing in urine in future screening programmes for anal cancer in men."
2709,0.004,4.0,"Chronic hepatitis B affects nearly 10% of HIV-infected patients. Hepatitis B virus (HBV) infection is a dynamic disease and coinfection with HIV impacts directly on the outcome of HBV infection, considerably complicating its natural history, diagnosis, and management. The aim of this study was to compare two cohorts of HBV monoinfected and HBV/HIV coinfected Iranian patients undergoing long-term lamivudine therapy from the clinical and virological aspects, as well as the frequency of detected mutations in HBV genome. To this end, HBV Pol/S regions from 72 patients were PCR-amplified and directly sequenced. Phylogenetic analysis indicated a 40-times higher risk of coinfection with ayw3 subtype of HBV genotype D rather than ayw2 subtype [P<0.001, odd: 40.66, CI: 95 % (4.69-352.23)]. While no resistance mutation was detected in HBV/HIV coinfected cohort, LAM-resistance mutations (rtM204I/V in YMDD and rtL180M in FLLA polymerase motifs) were identified in 30% (9 out of 30) and 16.66% (5 out of 30) of HBV monoinfected patients (P<0.05). Moreover, several mutations (sP105A, sI110S/L, sS136Y and sP127T/L) with significant differences in the frequency were identified in the S region of both cohorts. Finally, this study found strong correlation between the type of infection (mono or coinfection) and characteristics like patient gender, ALT levels, HBV-DNA levels and HBV subtypes. These results pointed to the importance of determination of HBV variants in the management of patients and suggested that in contrary to HBV monoinfections, LAM may be still an appropriate drug for the treatment of HBV in HBV/HIV coinfected patients; however, further studies to clarify the role of HIV in HBV LAM-resistance mutations are required."
5585,0.004,4.0,"The objective of this study was to determine the self-reported prevalence of needlestick injuries among practicing electromyographers. In January 2008, an anonymous electronic survey was sent to all active members of the American Association for Neuromuscular and Electrodiagnostic Medicine (AANEM) who provided e-mail addresses to the Association. Eight hundred and eight members (56% neurologists, 43% physiatrists; 97% practicing physicians, 3% trainees) responded, with a response rate of 22% (808 of 3659). The mean number of years in practice, involving electromyography (EMG) at least 1 day per week, was 16 years. A majority of physicians (64%) reported at least one needlestick injury involving EMG, and 8% reported five or more injuries. Needlestick injuries involving patients with human immunodeficiency virus/acquired immunodeficiency syndrome (HIV/AIDS), hepatitis B, and/or hepatitis C occurred in 1 of every 11 electromyographers. Nearly half of all respondents (44%) who experienced a needlestick injury stated that they did not report at least one injury event to official centers. Injuries were most likely to occur during a routine procedure (45%) or when a patient moved (26%). The most common preventable reason for injury was a perceived lack of time."
8747,0.004,4.0,"In a previous paper, we determined that treatment of lymphocytes with nonviable preparations of human immunodeficiency virus type 1 (HIV-1) results in an impairment of the phosphatidylinositol/protein kinase C pathway, most likely due to an inhibition of the cleavage of phosphatidylinositol bisphosphate into inositol trisphosphate and diacylglycerol, mediated by phospholipase C. Here we show that one consequence of these changes is a reduced phosphorylation of nuclear matrix-associated DNA topoisomerase II, resulting in an inhibition of the activity of this enzyme. Antibodies to the viral proteins suppressed the inhibitory effects caused by the HIV-1 preparation. Furthermore, the phytohemagglutinin A-caused augmentation of nuclear matrix-associated DNA polymerase alpha and beta activities was found to be abolished by coincubation with the HIV preparation or with the HIV-1 gp120. The phytohemagglutinin A-enhanced matrix association and processivity of DNA polymerase alpha was determined to be reduced if the lymphocytes were in contact with HIV-1 preparation. These results suggest that the reduced proliferative response of lymphocytes to phytohemagglutinin A in the presence of disrupted HIV-1 preparation is due to inhibition of at least two, perhaps separate, pathways, one involving protein kinase C resulting in a reduced phosphorylation of DNA topoisomerase II and the other changing the state of matrix association of DNA polymerase alpha and beta."
555,0.004,4.0,"The KwaZulu-Natal region of South Africa is experiencing an explosive outbreak of human immunodeficiency virus type 1 (HIV-1) subtype C infections. Understanding the genetic diversity of C viruses and the biological consequences of this diversity is important for the design of effective control strategies. We analyzed the protease gene, the first 935 nucleotides of reverse transcriptase, and the C2V5 envelope region of a representative set of 72 treatment-naïve patients from KwaZulu-Natal and correlated the results with amino acid signature and resistance patterns. Phylogenetic analysis revealed multiple clusters or ""lineages"" of HIV-1 subtype C that segregated with other C viruses from southern Africa. The same pattern was observed for both black and Indian subgroups and for retrospective specimens collected prior to 1990, indicating that multiple sublineages of HIV-1 C have been present in KwaZulu-Natal since the early stages of the epidemic. With the exception of three nonnucleoside reverse transcriptase inhibitor mutations, no primary resistance mutations were identified. Numerous accessory polymorphisms were present in the protease, but none were located at drug-binding or active sites of the enzyme. One frequent polymorphism, I93L, was located near the protease/reverse transcriptase cleavage site. In the envelope, disruption of the glycosylation motif at the beginning of V3 was associated with the presence of an extra protein kinase C phosphorylation site at codon 11. Many polymorphisms were embedded within cytotoxic T lymphocyte or overlapping cytotoxic T-lymphocyte/T-helper epitopes, as defined for subtype B. This work forms a baseline for future studies aimed at understanding the impact of genetic diversity on vaccine efficacy and on natural susceptibility to antiretroviral drugs."
6732,0.004,4.0,Underprivileged immigrants from endemic areas cumulate risk factors for infections by HIV-AIDS and hepatitis B and C. Free primary care consultations are available to them in the four health centers of the city of Paris. The objective of our study was to identify socio-demographic and medical factors related to the lack of screening proposition for HIV-AIDS and hepatitis B and C to new immigrant patients in these centers in 2003.
4080,0.004,4.0,"Russia has seen one of the world's fastest-growing HIV epidemics. Transmission risk behavior, HAART-taking, and psychosocial distress of the growing population of Russian people living with HIV (PLH) in the HAART era are understudied. Participants of a systematically-recruited cross-sectional sample of 492 PLH in St. Petersburg completed measures of sexual and drug injection practices, adherence, perceived discrimination, and psychosocial distress. Since learning of their status, 58% of participants had partners of HIV-negative or unknown serostatus (mean = 5.8). About 52% reported unprotected intercourse with such partners, with 30% of acts unprotected. Greater perceived discrimination predicted lower condom use. A 47% of IDU PLH still shared needles, predicted by having no primary partner, lower education, and more frequently-encountered discrimination. Twenty-five percentage of PLH had been refused general health care, 11% refused employment, 7% fired, and 6% forced from family homes. Thirty-nine percentage of participants had probable clinical depression, 37% had anxiety levels comparable to psychiatric inpatients, and social support was low. Of the 54% of PLH who were offered HAART, 16% refused HAART regimens, and 5% of those on the therapy took less than 90% of their doses. Comprehensive community services for Russian PLH are needed to reduce AIDS-related psychosocial distress and continued HIV transmission risk behaviors. Social programs should reduce stigma and discrimination, and promote social integration of affected persons and their families."
7070,0.004,4.0,"For assessing the role of circulating immune complexes (CICs) in acute hepatitis B, CICs containing HBsAg, IgM, and IgG were determined, by C1q and conglutinin (K) assays, in 242 patients with acute hepatitis B and 60 healthy controls. CIC is a common feature of acute hepatitis B with 90.9% of cases having at least one abnormal test result. Patients with shorter interval (< 1 week) between onset of symptoms and patient presentation have significantly higher frequency of abnormal IgM class CIC, HBsAg-specific CIC, and higher frequency of raised alanine aminotransferase activity (> 30-fold upper limit of normal). The prevalence of raised alanine aminotransferase in patients with CIC containing HBsAg and IgM is higher than those without (P = 0.001). There is significant association between HBsAg-CIC and C1q-CIC. In conclusion, HBsAg-CIC and IgM class CIC correlate with disease activity. C1q-binding CIC is the predominant CIC that may play a role in the pathogenesis of acute hepatitis B."
9656,0.004,4.0,"Anticardiolipin antibodies (ACAs) are formed against phospholipids in various clinical conditions such as autoimmune diseases, malignancy, infectious diseases, alcohol-related and hepatic cirrhosis. The aims of this study were to investigate the presence of ACAs in patients with chronic hepatitis B together with positive total anti-delta antibodies, and to investigate the relationship between age, gender, and some laboratory parameters (ALT, AST, albumin, globulin, platelet number) of patients with chronic hepatitis delta virus (HDV) infection, who were positive or negative for ACAs. A total of 60 patients (43 male, 17 female) with chronic hepatitis D infection [HBsAg positive, HBeAg negative, anti-HBe positive, anti-HBc IgG positive, anti-HBc IgM negative, total anti-delta positive, anti-HCV negative] and 30 patients (21 male, 9 female) without hepatitis D infection [HBsAg positive, HBeAg negative, anti-HBe positive, anti-HBc IgG positive, anti-HBc IgM negative, total anti-delta negative, anti-HCV negative] as control group were included to the study. ACA IgG and IgM were searched by a commercial microELISA kit (Euroimmun, Germany). The statistical evaluation was performed with Pearson's chi-square test, Student's t-test, and Fisher's exact test. Total ACAs positivity rate of 60 patients with chronic HDV infection, was found as 13.3%, in which four of the patients were positive for only ACA IgM, while four was positive for only IgG. Positivity for both ACA IgG and ACA IgM could not be detected in these patients. No patients in the control group had positivity for ACAs (IgG and/or IgM). A statistically significant difference was observed in terms of ACA positivity between patients with and without HDV infection (p< 0.05). After all, there was no statistically significant correlation between ACAs positivity and the age, sex, and laboratory parameters of the patients with chronic HDV infection, except lower serum albumin levels (p= 0.004). Although the data of this study revealed a statistically significant positive correlation between chronic HDV infection and anticardiolipin antibodies, it is clear that there is a need for further studies on this subject."
9239,0.004,4.0,"The prevalence of hepatitis virus markers in patients with chronic liver diseases from two countries has been studied: 68 patients (38 alcoholic hepatitis or cirrhosis, 30 chronic HBsAg-positive hepatitis) from Hungary as well as 109 patients (55 alcoholic liver disease, 45 chronic hepatitis or cryptogenic cirrhosis and 9 hepatoma) from Romania were examined for HBsAg, anti-HBs, anti-HBc, anti-HCV and anti-HDV, using the corresponding Abbott Elisa test systems. In alcoholic liver disease HBsAg occurred in 6/38 patients from Hungary and in 22/55 patients respectively, that is HBV markers occurred with significantly higher frequency in alcoholic patients from Romania (p less than 0.05). In the Hungarian group a total of 36 patients were HBsAg positive and out of them 5 had anti-HDV (13.9%), while out of 21 Romania HBsAg carriers 10 patients had anti-HDV (47.6%). Among 9 hepatoma patients 4 had HBsAg, 6 anti-HBs and 7 anti-HBc and 4 had anti-HCV and 3 had anti-HDV. One patient with hepatoma had both HBsAg and anti-HCV plus anti-HDV as well. Results suggest that the infection with hepatitis viruses in alcoholic liver diseases is more common in Romania than in Hungary, and the prevalence of delta virus infection in HBV carriers is also significantly higher in Romania than in Hungary."
8027,0.004,4.0,"Parasitic infections continue to take their toll on HIV positive patients by influencing the blood qualitatively and quantitatively. The objective of this study was to determine the prevalence of intestinal parasitic infections in relation to anaemia and CD4 counts among HIV-infected patients in Benin City, Nigeria. Using a serial sampling method, a total of 2000 HIV-infected patients were recruited on their first visit prior to highly active anti-retroviral therapy (HAART) at the University of Benin Teaching Hospital from August 2007 to August 2009. Stool and blood samples were collected from each patient. The stool samples were processed using the modified Ziehl-Neelsen staining technique to microscopically identify the oocysts of Cryptosporidium species, Isospora belli, Cyclospora species and spores of Microsporidium species while saline and iodine preparations were used for identifying the ova, cysts and parasites of Ascaris lumbricoides, hookworm, Taenia spp and other parasites. The blood specimens were equally analyzed using the flow cytometry for CD4+ T-lymphocyte count and autoanalyzer - sysmex kx - 21 for haemoglobin concentration. The overall prevalence of anaemia was 93.3% while 18% had parasitic infections. There was a significant relationship between CD4 count <200cells/microL and anaemia (P<0.0001). Cryptosporidium species (P= 0.005), A. lumbricoides (P=0.035), hookworm and Taenia species (P=0.014) were associated with anaemia. Anaemia was associated with CD4 count while Cryptosporidium species, Ascaris lumbricoides, hookworm and Taenia species were the intestinal parasitic agents associated with anaemia. In conclusion the prevalence of anaemia in HIV-infected patients is high low CD4 count is a significant risk factor of acquiring anaemia. Except for isosporiasis, cryptosporidiosis, A. lumbricoides, hookworm and Taenia species in HIV infected individuals are parasitic agents associated with anaemia. Routine screening for intestinal parasites and holistic management of anaemia is advocated."
7600,0.004,4.0,"Tenofovir disoproxil fumarate (TDF) therapy is a therapeutic option for nucleos(t)ide analogue (NA)-experienced chronic hepatitis B (CHB) patients infected with hepatitis B virus (HBV). In this study, we evaluated the efficacy of TDF alone compared with the efficacy of TDF plus additional NA combinations in NA-experienced CHB patients."
198,0.004,4.0,"Antiviral pre-exposure prophylaxis (PrEP) through daily drug administration can protect healthy individuals from HIV-1 infection. While PrEP was recently approved by the FDA, the potential long-term consequences of PrEP implementation remain entirely unclear. The aim of this study is to predict the efficacy of different prophylactic strategies with the pro-drug tenofovir-disoproxil-fumarate (TDF) and to assess the sensitivity towards timing- and mode of TDF administration (daily- vs. single dose), adherence and the number of transmitted viruses. We developed a pharmacokinetic model for TDF and its active anabolite tenofovir-diphosphate (TFV-DP) and validated it with data from 4 different trials, including 4 distinct dosing regimes. Pharmacokinetics were coupled to an HIV model and viral decay following TDF mono-therapy was predicted, consistent with available data. Subsequently, a stochastic approach was used to estimate the % infections prevented by (i) daily TDF-based PrEP, (ii) one week TDF started either shortly before, or -after viral exposure and (iii) a single dose oral TDF before viral challenge (sd-PrEP). Analytical solutions were derived to assess the relation between intracellular TFV-DP concentrations and prophylactic efficacy. The predicted efficacy of TDF was limited by a slow accumulation of active compound (TFV-DP) and variable TFV-DP half-life and decreased with increasing numbers of transmitted viruses. Once daily TDF-based PrEP yielded [Formula: see text]80% protection, if at least 40% of pills were taken. Sd-PrEP with 300 mg or 600 mg TDF could prevent [Formula: see text]50% infections, when given at least before virus exposure. The efficacy dropped to [Formula: see text]10%, when given 1 h before 24 h exposure. Efficacy could not be increased with increasing dosage or prolonged administration. Post-exposure prophylaxis poorly prevented infection. The use of drugs that accumulate more rapidly, or local application of tenofovir gel may overcome the need for drug administration long before virus exposure."
5185,0.004,4.0,"In Taiwan the Hepatitis B virus (HBV) carrier rate is 15% to 20%. Mother infant transmission plays the most important role in the endemy resulting in 20% of the children being HBsAg carrier at 4 years of age. A large proportion of HBV carriers will develop a chronic hepatitis leading to cirrhosis and ultimately to primary hepatocellular carcinoma. Children born to HBsAg +/HBeAg + mothers (7% of neonates) have an estimated risk of 90% to become HBsAg chronic carriers. A plan for control of Hepatitis B in Taiwan will aim to solve the problem of these children, as a priority. A Hepatitis B vaccine trial has been undertaken in Taiwan since October 1981 in a selected population of children born to HBsAg +/HBeAg + mothers. The purpose of the study was to determine the efficacy of Hepatitis B vaccine alone or in combination with Hepatitis B immunoglobulin in preventing maternal infant transmission of HBV infection. A three way prophylactic regimen comparison was carried out. Subjects consisted of children born to HBsAg +/HBeAg + mothers. Only mature and apparently healthy neonates were included with the parents' formal consent based on real knowledge and understanding. Babies were randomly included in four different groups of study."
4664,0.004,4.0,"Acquired Immunodeficiency Syndrome (AIDS) pandemic has become a major global public health problem with rising number of cases and associated deaths. Most of the present activities in developing countries, especially in Africa, are aimed at reducing the transmission of the Human Immunodeficiency Virus (HIV) that causes AIDS. Care for people living with HIV/AIDS (PLWHA) is essential not only to mitigate the impacts of HIV/AIDS among PLWHA but is also an important component of prevention of the disease. There is now a general recognition that comprehensive care across the continuum should be provided to PLWHA through all the stages of infection, with a crucial role for community-home based care activities. In addition, AIDS orphans need to be supported Although, documented evidences abound on the utility of comprehensive care and community-home based care approaches outside Africa and in some African countries, there is little information on them in Nigeria. This paper therefore reviews the recent epidemiology of HIV infection, the many currently developed initiatives to deliver comprehensive care for PLWHA in the hospital, community and at home, and the issue of AIDS orphans. In addition, measures to effectively integrate them into the mainstream of societal activities are discussed."
