Document Order,Normalized Frequency,Raw DF,Abstract
6550,0.006,6.0,Hepatitis B virus (HBV) affects people worldwide but the local burden especially in pregnant women and their new born babies is unknown. In Rwanda HIV-infected individuals who are also infected with HBV are supposed to be initiated on ART immediately. HBV is easily transmitted from mother to child during delivery. We sought to estimate the prevalence of chronic HBV infection among pregnant women attending ante-natal clinic (ANC) in Rwanda and to determine factors associated with HBV and HIV co-infection.
9735,0.006,6.0,"Coinfection by the Human Immunodeficiency Virus (HIV) and hepatitis viruses is a frequent condition in drug addicts. In the present study we report on the case of a patient with a history of drug and alcohol abuse who was sequentially infected with HIV, HCV, HBV and HDV. He died of an overwhelming reactivation of HBV and HDV in spite of a recent interferon treatment. HBV and HDV resumed their active replication after over 20 years of complete latency, that is after long-lasting viral undetectability, when the patient deliberately discontinued his last HAART regimen. HBV and HDV reactivated in spite of a relatively preserved immune system and a recent immune stimulatory treatment with pegylated interferon."
9760,0.006,6.0,"The prevalence of serum markers of delta hepatitis was determined prospectively in 82 intravenous drug abusers at various stages of human immunodeficiency virus (HIV) disease. Seventeen were HIV negative, 30 were HIV positive without acquired immunodeficiency syndrome (AIDS) and 35 had been diagnosed as having AIDS. Antihepatitis D virus (HDV) in serum was measured by a commercially available enzyme-linked immunosorbent assay (ELISA) and also by solid phase capture radioimmunoassays (RIAs) for immunoglobulin G (IgG) and immunoglobulin M (IgM) anti-HDV. HDV antigen and hepatitis B virus (HBV) DNA were also measured. Hepatitis B surface antigen (HBsAg) and anti-HBs were determined by using a commercially available RIA. Anti-HDV (RIA) was only detected in serum that contained HBsAg. These anti-HDV (RIA) positive samples also tested positive with the commercial anti-HDV electroimmunoassay. In addition, the commercial anti-HDV ELISA detected anti-HDV in some serum samples that were negative for HBsAg; these anti HDV-positive HBsAg-negative samples were frequently lipemic or contained rheumatoid factor. The prevalence of HBsAg and anti-HBs did not differ significantly with the stage of HIV disease. HBsAg was detected in 3 of 13 (23%) HIV-negative, 5 of 29 (17%) HIV-positive, and 4 of 18 (22%) patients with AIDS. IgG and IgM anti-HDV (RIA) was positive in 2 of 3 HIV-negative and 4 of 5 HIV-positive pre-AIDS HBsAg-positive subjects. However, none of 4 AIDS patients had anti-HDV. The difference between AIDS and non-AIDS patients was statistically significant (Fisher's exact test, p = 0.03). HDV antigen was detected in serum from one AIDS patient.(ABSTRACT TRUNCATED AT 250 WORDS)"
5738,0.006,6.0,"The objective of this study was to estimate the presence of hepatitis delta virus RNA in chronically HBV-infected patients from northern Poland. Three out of 63 studied samples (4.8%) were positive in a qualitative test for total antibodies to HDV antigen. Five samples (7.9%) turned out to be HDV-RNA-positive by RT-PCR, four of them were sequenced in the region of L-HDAg, and phylogenetic analysis was performed. All four examined samples belonged to genotype I. Two RNA-positive/anti-HD-negative samples possessed a few uncommon nucleotide substitution sites within the L-HDAg sequence, which could suggest unique variants in the Polish population of HDV-infected patients."
6718,0.006,6.0,"The Ryan White Comprehensive AIDS Resources Emergency Act 1990 (CARE Act) is one of the largest federal programmes funding medical and support services for individuals with HIV disease. Data that report services and gaps in service coverage from the organizational perspective are very limited. The Antiretroviral Treatment and Access Studies included a mail survey of 176 HIV medical care facilities in four US inner cities on clinic characteristics, services and practices, and patient characteristics. Characteristics of 143 (85%) responding Ryan White (RW) funded and non-RW funded facilities are described. RW funded facilities reported offering more services than non-funded facilities including evening/weekend hours (49% vs. 18%), transportation (71% vs. 22%), and on-site risk reduction counselling (88% vs. 55%). More RW funded facilities reported offering on-site adherence support services, such as support groups (44% vs. 12%), formal classes (20% vs. 2%), and pillboxes (83% vs. 43%), and served a larger proportion of uninsured patients (41% vs. 4%) than non-funded facilities. Our analysis showed that the RW funded HIV care facilities offered more clinic, non-clinic, and adherence support services than non-RW funded facilities, indicating that the disparities in services were still related to CARE Act funding, controlling for private-public facility type."
7280,0.006,6.0,"The aim of this study is to detect the possible association of hepatitis B virus (HBV) core mutation, hepatitis B e antigen (HBeAg) status and the viral load in chronic hepatitis B (CHB) patients. Sixty-six patients with CHB were enrolled. Hepatitis markers and hepatitis C virus antibody (HCV-Ab) were tested using micro particle enzyme immunoassay kits. Viral load was measured by real-time polymerase chain reaction (PCR) and the mutation was analyzed by nested PCR followed by restriction fragment length polymorphism. Most of CHB patients were HBeAg (-ve). The HBeAg status did not have an influence on the presence or absence of T1762/A1764 mutation. HBV-DNA serum level was not significantly different in patients with core mutation and patients without core mutation in HBeAg (-ve) group, while in HBeAg (+ve) group HBV-DNA serum level was significantly higher in patients with core mutation. This study reports the predominance of HBeAg (-ve) and HBV core promoter mutation."
5606,0.006,6.0,"Molecular clones of HIV-1 were obtained from isolates cultured from peripheral blood mononuclear cells (PBMCs) and directly from uncultured PBMCs from a laboratory worker accidentally infected with the HIV-1 laboratory strain, HIV-1(HTLV-IIIB). Envelope sequences corresponding to the first 752 amino acids of HIV-1(HTLV-IIIB) clone BH10 were obtained from clones of cultured virus and sequenced. Three env clones obtained shortly after infection differed among themselves at only seven nucleotide positions, resulting in one amino acid substitution and one frameshift mutation. These envelope sequences were as similar to the envelope sequences of various IIIB clones as the latter were to each other. env divergence increased over the course of infection. However, the overall diversity in env clones obtained two or more years after infection was still comparable to that among IIIB env clones from the original IIIB culture. Multiple clones of partial env gene sequences containing the V3 loop were also obtained directly from uncultured PBMCs by polymerase chain reaction amplification. The env sequences of these clones were generally similar to those of the cultured viruses. Within the V3 region, the earliest isolates retained the sequence of the HXB2 clone from IIIB. Clones obtained later showed a progressive divergence in V3. An A-to-T substitution within the GPGRAF sequence at the tip of the V3 loop was observed within 1 year after infection, and this mutation predominated in all subsequent isolates. Antibodies against the V3 loops of IIIB and divergent 1987 and 1990 LW isolates appeared simultaneously in laboratory worker serum and persisted with no significant differences in titer. Furthermore, neutralization studies with autologous sequential sera suggested selection for the A-to-T change in V3 was not due to V3-directed antibodies. These results demonstrate a surprising homogeneity among env sequences of HIV-1 from an infected laboratory worker, perhaps because the initial infection originated from a relatively homogeneous population of tissue culture-adapted virus."
118,0.006,6.0,Coinfection of human immunodeficiency virus (HIV) and hepatitis C virus (HCV) is a substantial medical and public health concern due to its increasing prevalence and complex patient management. Alcohol use may worsen HCV-related liver disease and interfere with adherence to antiretroviral therapy (ART) and medical care. We therefore studied the association between HCV infection and markers of HIV disease progression in adults with alcohol problems.
821,0.006,6.0,"Recurring outbreaks of acute hepatitis have been a significant cause of morbidity and mortality among Peruvian military personnel stationed in the Amazon Basin region of Peru. The role of hepatitis B virus (HBV) and hepatitis D virus (HDV) infection was investigated as the possible cause of acute hepatitis among 88 military patients stationed at four different jungle outposts during 1992-1993. Analysis of serum markers indicated that 95% (84/88) had evidence of acute HBV infection; 64% (54/84) were also infected with HDV. Genetic analysis of PCR-amplified HDV and HBV fragments showed exclusively HDV genotype III and HBV genotype F. Furthermore, HDV RNA sequences were similar among patients from the same outpost but different from those at other jungle locations. The data suggested focal sources of HDV infection in the jungle environment of the outposts and, further, confirmed the unique association of HDV genotype III with severe cases of human disease in northern South America."
8299,0.006,6.0,"The aim of this study was to explore the prevalence of basal core promoter (BCP) and precore gene (PC) mutations in hepatitis B virus (HBV) isolates among the Nicobarese tribe and their relationship with genotypes and HBeAg status. A total of 726 blood samples were collected from two villages of the Car Nicobar Island where mass vaccination was performed in the year 2000. HBV DNA was isolated and the BCP and PC regions were amplified and sequenced directly. The samples positive for HBV DNA were tested for HBsAg, HBeAg and anti-HBe. Among the 211 and 515 samples collected from vaccinated and nonvaccinated persons, 16 and 82 were positive for HBV DNA, respectively. Among the vaccinated individuals, only 1 had a mutation in both the BCP and PC gene. Among the nonvaccinated subjects, 3 (4.5%) had an A1762T mutation, 8 (12.1%) had a G1764A mutation, 11 (16.7%) had a G1896A mutation and 4 (6.1%) had a G1899A mutation. The HBeAg-negative subjects had a significantly higher frequency of BCP and PC mutations than the HBeAg-positive subjects. The prevalence of a PC mutation was higher than that of a BCP mutation. The present study stresses the need for the continuous surveillance of subjects with BCP and PC mutations, as the mutations may contribute to the progression of liver disease."
4552,0.006,6.0,"Patients with HIV and hepatitis C virus (HCV) coinfection have more severe hepatitis-related disease than do patients with HCV infection alone. Highly active antiretroviral therapy (HAART) with protease inhibitor appears to restore pathogen-specific immune responses, especially in patients with persistent undetectable HIV viral load. To evaluate the potent impact of immune restoration induced by HAART on the course of HCV-related disease, HCV viremia and levels of transaminases were compared between two groups of patients: 10 HIV/HCV-coinfected patients with persistently undetectable HIV viremia (group A) and 12 HIV/HCV-coinfected patients with persistent detectable HIV viremia. No difference was detected in HCV viral load in either group. An increase in transaminases was found only in patients with persistent undetectable HIV viral load, which was correlated with the increase in CD8+ T cells. This may suggest that the restoration of CD8+ T cell cytotoxicity could lead to an enhancement of hepatitis C-related disease in HCV/HIV-coinfected patients receiving HAART."
4913,0.006,6.0,"Human immunodeficiency (HIV), hepatitis B (HBV), and hepatitis C (HCV) viruses are endemic in Sub-Saharan Africa, but data regarding the prevalence of hepatitis co-infections in HIV-positive individuals residing there are limited. The aim of the study was to determine the prevalence of HBV, HCV, and occult HBV (presence of HBV-DNA in the absence of HBsAg) in a rural, South African cohort. The results were compared to various ethnic groups in a Dutch cohort of people infected with HIV. Antiretroviral-naïve individuals with HIV from both a rural South African clinic (n = 258), and a Dutch University hospital (n = 782), were included. Both serological (HBV and HCV) and molecular (occult HBV) assays were performed. Logistic regression analysis was used to define independent predictors of a hepatitis co-infection. HBV and HCV prevalence rates in the South African cohort were exceptionally low (0.4%, 1/242 and 0.8%, 2/242, respectively), compared to those observed in Caucasians (HBV 4.4% and HCV 10.9%) and African immigrants (HBV 8.9% and HCV 4.8%). Conversely, occult HBV was observed in a considerable proportion (10%, 6/60) of South African patients who were anti-HBc-positive but HBsAg-negative. Occult infections were less frequent in Caucasians and Africans in the Dutch cohort (3.2% and 1.4%, respectively). Independent predictors for occult HBV were not identified, but a trend towards more occult HBV at lower CD4 counts was observed. Local HBV/HCV prevalence data are needed to optimize vaccination and antiretroviral treatment strategies. Occult HBV in patients with HIV may be missed regularly when molecular analyses are not available."
2192,0.006,6.0,"Human immunodeficiency virus (HIV)-specific cytotoxic T lymphocytes (CTLs) are thought to play a major role in the immune response to HIV infection. The HIV-specific CTL response is much stronger than previously documented in an infectious disease, yet estimates of CTL frequency derived from limiting-dilution analysis (LDA) are relatively low and comparable to other viral infections. Here we show that individual CTL clones specific for peptides from HIV gag and pol gene products are present at high levels in the peripheral blood of three infected patients and that individual CTL clones may represent between 0.2% and 1% of T cells. Previous LDA in one donor had shown a frequency of CTL precursors of 1/8000, suggesting that LDA may underestimate CTL effector frequency. In some donors individual CTL clones persisted in vivo for at least 5 years. In contrast, in one patient there was a switch in CTL usage suggesting that different populations of CTLs can be recruited during infection. These data imply strong stimulation of CTLs, potentially leading some clones to exhaustion."
8895,0.006,6.0,"Insufficient data are available from single cohort studies to allow estimation of the prognosis of HIV-1 infected, treatment-naive patients who start highly active antiretroviral therapy (HAART). The ART Cohort Collaboration, which includes 13 cohort studies from Europe and North America, was established to fill this knowledge gap."
5202,0.006,6.0,"The hepatitis B virus (HBV) infection is a major risk factor in the development of chronic hepatitis (CH) and hepatocellular carcinoma (HCC). The activation‑induced cytidine deaminase (AID)/apolipoprotein B mRNA editing enzyme, catalytic polypeptide‑like (APOBEC) family of cytidine deaminases is significant in innate immunity, as it restricts numerous viruses, including HBV, through hypermutation‑dependent and ‑independent mechanisms. It is important to induce covalently closed circular (ccc)DNA degradation by interferon‑α without causing side effects in the infected host cell. Furthermore, organisms possess multiple mechanisms to regulate the expression of AID/APOBECs, control their enzymatic activity and restrict their access to DNA or RNA substrates. Therefore, the AID/APOBECs present promising targets for preventing and treating viral infections. In addition, gene polymorphisms of the AID/APOBEC family may alter host susceptibility to HBV acquisition and CH disease progression. Through G‑to‑A hypermutation, AID/APOBECs also edit HBV DNA and facilitate the mutation of HBV DNA, which may assist the virus to evolve and potentially escape from the immune responses. The AID/APOBEC family and their associated editing patterns may also exert oncogenic activity. Understanding the effects of cytidine deaminases in CH virus-induced hepatocarcinogenesis may aid with developing efficient prophylactic and therapeutic strategies against HCC."
1316,0.006,6.0,"Project HEART, an acronym for Helping Enhance Adherence to Retroviral Therapy, was a prospective, controlled study to develop, implement, and evaluate a clinic-based behavioural intervention to prevent adherence failure among HIV-infected adults beginning their first highly active antiretroviral therapy (HAART) regimen (N = 227). In this paper, we describe the conceptualisation of the Project HEART adherence intervention, characteristics of the participants, and lessons learned implementing HEART in an inner-city clinic setting. A multi-component intervention, HEART combined enhanced education, reminders, adherence feedback, social support and adherence-focused problem solving in an integrated manner to address common cognitive, motivational, and social barriers to adherence. Unique components of the intervention included use of participant-identified adherence support partners and a standardized adherence barriers assessment to develop and implement individualised adherence plans. Lessons learned regarding the feasibility of using participant-identified support partners were as follows. Few participants eligible for the study had trouble identifying a support partner. Over 90% of support partners attended at least one intervention visit. Support partners were most available and amenable to participate early in the initiation of therapy. Participants' experiences as the 'supported' partner were generally positive. Though many participants faced barriers not easily addressed by this intervention (for example, housing instability), formally integrating support partners into the intervention helped to address many other common adherence barriers. Family and friends are an under-utilised resource in HIV medication adherence. Enlisting the help of support partners is a practical and economical approach to adherence counselling."
3760,0.006,6.0,"Liver transplantation for hepatitis B virus (HBV)-related liver disease is complicated by HBV recurrence and, consequently, poor patient and graft survival. Patients transplanted for hepatitis delta virus (HDV)-related cirrhosis are reported to have a diminished incidence of HBV recurrence and improved graft survival. However, only a few reported HDV-infected patients had active HBV replicative disease before liver transplantation. In our experience, we transplanted two HDV-infected patients, both of whom had active HBV replication before liver transplantation. In one patient, hepatitis B surface antigen (HBsAg) recurred four months after transplantation. Two months later, Hepatitis Be antigen (HBeAg) and HBV-DNA became positive, and the patient died of fulminant recurrent hepatitis B and hepatitis delta. In the other patient, HBV persisted after transplantation, and 2 months later the patient required retransplantation for fulminant recurrent hepatitis B and hepatitis delta. With the second graft, the patient remained free of HBV infection for 1 year. Thereafter, the patient experienced HBV recurrence with active replication and died of fulminant hepatitis B and delta recurrence. In the first case and in the second graft of the second case, hepatitis B immunoglobulin (HBIG) immunoprophylaxis was administered in an attempt to prevent recurrence of HBV. The literature suggests that an HDV infection inhibits the replication of HBV and therefore plays a role in preventing the recurrence of HBV and improving survival. Our experience with two patients suggests that HDV infection, in the presence of active HBV replication, may not play a protective role."
5564,0.006,6.0,"Adolescent Impact, a developmentally targeted behavioral intervention aimed at decreasing risk behaviors and promoting health care adherence, was delivered to 83 HIV-infected youth, aged 13-21 years, receiving care in five urban HIV centers. Participants completed a patient satisfaction survey following the 12 part intervention consisting of seven groups and five individual sessions. A feedback questionnaire was also completed during each group session to gain more insight on participant experiences. Several indicators suggested high levels of satisfaction. First, overall attendance was relatively high. Second, participants rated their subjective experience and group content favorably. No differences in satisfaction ratings emerged between perinatally infected adolescents and those who acquired HIV through risk behaviors. However, differences emerged regarding perceived intervention utility and content-specific preferences. Findings suggest that Adolescent Impact participants were satisfied with the intervention and that a heterogeneous group of HIV-infected youth could be advantageously integrated into the same secondary prevention program."
7864,0.006,6.0,"The high levels of hepatitis B virus (HBV) surface antigen (HBsAg)-bearing subviral particles in the serum of chronically infected individuals play an important role in suppressing HBV-specific immune response and are only mildly affected by the current small molecule therapies. Thus, a therapy that specifically reduces HBsAg serum levels could be used in combination therapy with nucleos(t)ide drugs or permit therapeutic vaccination for the treatment of HBV infection. Herein, we report the design, synthesis, and evaluation of novel triazolo-pyrimidine inhibitors (1, 3, and 4) of HBsAg cellular secretion, with activity against drug-resistant HBV variants. Extensive SAR led to substantial improvements in the EC(50) of the parent compound, 5 (HBF-0259), with the best being 3c, with EC(50) = 1.4 ± 0.4 μM, SI ≥ 36. The lead candidates, both 1a (PBHBV-001) and 3c (PBHBV-2-15), were well-tolerated in both normal and HBV-transgenic mice and exhibited acceptable pharmacokinetics and bioavailability in Sprague-Dawley rats."
5923,0.006,6.0,"The widespread use of antiretroviral therapy and remarkable success in the treatment of paediatric HIV infection has changed the face of the Human Immunodeficiency Virus (HIV) epidemic in children from a fatal disease to that of a chronic illness. Many children living with HIV are surviving into adolescence. This sub-population of people living with HIV is emerging as a public health challenge and burden in terms of healthcare management and service utilization than previously anticipated. This article provides an overview of the socio-developmental challenges facing adolescents living with HIV especially in a resource-limited setting like Nigeria. These include concerns about their healthy sexuality, safer sex and transition to adulthood, disclosure of their status and potential stigma, challenges faced with daily living, access and adherence to treatment, access to care and support, and clinic transition. Other issues include reality of death and implications for fertility intentions, mental health concerns and neurocognitive development. Coping strategies and needed support for adolescents living with HIV are also discussed, and the implications for policy formulation and programme design and implementation in Nigeria are highlighted."
2231,0.006,6.0,"Infection with human immunodeficiency virus (HIV) has been associated with increased rates of single- and multidrug-resistant (MDR) tuberculosis in the New York City area. In order to examine the relationship of HIV infection to drug-resistant tuberculosis in other selected regions of the United States, we established a registry of cases of culture-proven tuberculosis. Data were collected from sites participating in an NIH-funded, community-based HIV clinical trials group. All cases of tuberculosis, regardless of HIV status, which occurred between January 1992 and June 1994 were recorded. Overall, 1,373 cases of tuberculosis were evaluated, including 425 from the New York City area, and 948 from seven other metropolitan areas. The overall prevalence of resistance to one or more drugs was 20.4%, and 5.6% of isolates were resistant to both isoniazid and rifampin (MDR). In the New York City area, HIV-infected patients were significantly more likely than persons not known to be HIV-infected, to have resistance to at least one drug (37% versus 19%) and MDR (19% versus 6%). In other geographic areas, overall drug resistance was 16%, and only 2.2% of isolates were MDR. In multiple logistic regression analyses, HIV infection was shown to be a risk factor for drug-resistant tuberculosis, independent of geographic location, history of prior therapy, age, and race. We concluded that HIV infection is associated with increased rates of resistance to antituberculosis drugs in both the New York City area and other geographic areas. MDR tuberculosis is occurring predominantly in the New York City area and is highly correlated with HIV infection."
